{"calibration_context":{"analog_sample_count":40,"confidence":"LOW","limitations":["Es gibt erst einen vollst\u00e4ndig bewerteten oracle-v4.0.0-Paper-Trade; die Mindeststichprobe von 30 Trades ist nicht erreicht.","Die 1h-Analogs sind descriptive_only; die 4h- und 12h-Analogs liegen mit 17 beziehungsweise 5 Samples unter minimum_samples 20.","oracle_context ist partial; mehrere historische Flow- und OI-Perzentile sind wegen 118 statt mindestens 168 Prior-Samples unavailable.","Das erste exportierte Perp-Intraday-Quartal ist partial, obwohl das aggregierte 1h-Flow-Fenster vollst\u00e4ndig ist.","Beide Reversal-Gates haben abc_ready=false und trigger_candidate=false.","F\u00fcr NO_TRADE ist in der Consumer-Projektion keine passende oracle-v4.0.0-Scorecard-Gruppe exponiert.","Alle exportierten Time-Fib-Fenster sind abgelaufen."],"scorecard_sample_count":0,"status":"uncalibrated"},"created_at_utc":"2026-09-21T19:09:44Z","decision":{"regime":"NO_TRADE","stance":"FLAT","summary":"Keine neue Order: 1h-Breadth, relative St\u00e4rke und OI stabilisieren sich, doch Spot- und Perp-Flow bleiben netto negativ und die best\u00e4tigte 1h-Struktur wechselte auf HL/LH. Long und Short haben damit aktuell keinen sauberen gemeinsamen Trigger."},"evidence":{"decisive_timeframes":["15m","30m","1h","4h","12h","1d","1w"],"opposing_feature_ids":["flow.spot.signed_dot","flow.perp.signed_dot","flow.spot.divergence","flow.perp.divergence","structure.1h.transition","structure.1h.new_high","relative.4h.ratio_return_pct","extension.anchored_vwap"],"supporting_feature_ids":["breadth.1h.positive_fraction","breadth.1h.turn_pp","relative.1h.ratio_return_pct","relative.1h.acceleration_pp","oi.1h.price_relation","levels.1h.reactions"]},"forecast_horizons":{"12h":{"direction":"FLAT","rationale":"Daily bleibt HH/HL und Weekly LH/LL; zugleich liegen die 12h-Analogs mit 5 Samples unter dem Minimum von 20."},"1h":{"direction":"FLAT","rationale":"Preis und OI stiegen leicht, Breadth erreichte 100 Prozent und der sp\u00e4te Flow drehte positiv; der vollst\u00e4ndige Stundenflow blieb jedoch in Spot und Perp negativ und die 1h-Struktur best\u00e4tigte ein LH."},"4h":{"direction":"FLAT","rationale":"DOT verlor 1.71 Prozent gegen BTC und das OI sank, w\u00e4hrend die letzte geschlossene 4h-Kerze nahe dem Hoch schloss und 1.1715 als gescheiterter Breakdown reagierte."}},"forecast_id":"20260921T190944Z-fbf4923e315a-oracle-v4","ledger_state_sha256":"135351ea1c5cea5aa6d57d69c6c596549258b4a27123da38251e8bbf65e331da","management":[],"market":"DOTUSD","measurement_config_sha256":"b0419c4ed2b156a6723551ea2a8cd5b32c6ed08f70261b6c0bad818b0fe445a9","oracle_config_sha256":"298a079a85bb0cc92ff6438699b9dac212f8beba447537a596ce61a9e8f3fe77","oracle_feature_version":"3.0.0","orders":[],"primary_market":"PF_DOTUSD","schema_version":2,"snapshot_generated_at_utc":"2026-09-21T19:00:33.646736Z","snapshot_sha256":"fbf4923e315a57f5917e50f6bafa71b4b9bde33c95c09b6673ad2b5e747823ca","strategy_version":"oracle-v4.0.0","text_summary":"REFLOOP: Letzter persistierter v4-Forecast ist 20260921T151021Z-8efa08b7e805-oracle-v4. Trade 20260921T151021Z-8efa08b7e805-oracle-v4-1 ist complete mit 22.441907089272139331 USD netto und net_r 2.029472516664147163230240549828179 bei vollst\u00e4ndiger Funding-Abdeckung. Neues Spot-Feedback: (20260921T151021Z-8efa08b7e805-oracle-v4,1h,2.0.0)=direction_only mit +1.0101860426 Prozent und (20260921T131256Z-d0216faefd61-oracle-v4,4h,2.0.0)=abstained mit -0.0928661882651 Prozent. Konsequenz: nach einem Trade keine Schwelle oder Risikostufe \u00e4ndern; aktuell FLAT wegen positiver 1h-Stabilisierung gegen weiterhin negativen Stundenflow und best\u00e4tigtes 1h-LH. Ledger order und position null."}
